{
  "schema_version": 1,
  "cycle_id": "2026-09-29",
  "repo": "MaciejRucinskiVIMN/branch-cleanup-test-no-prod",
  "state": "voting",
  "dry_run": false,
  "opened_at": "2026-09-29T09:00:00Z",
  "voting_closes_at": "2026-10-06T09:00:00Z",
  "finalized_at": null,
  "criteria": {
    "branch_stale_after_days": 90,
    "pr_stale_after_days": 60,
    "exempt_prefixes": ["archive/", "release/", "dependabot/"],
    "skip_protected": true,
    "include_draft_prs": true
  },
  "jira_issue_key": "PLGQEES-2894",
  "slack_channel": "C09QE7RN4KD",
  "slack_thread_ts": "1790672400.004200",
  "candidate_count": 6,
  "skipped": {
    "exempt_prefix": ["archive/old-experiment", "release/2026-q1"],
    "protected": ["main", "branch-cleanup-state"],
    "active_pr": ["feature/recently-active"]
  }
}
